SQL> @z:/classes.sql
SQL> REM ********************************************************************
SQL> REM	  UCS 1412 - DATABASE LAB | IV SEMESTER
SQL> REM	  EX : 2 DML COMMANDS
SQL> REM
SQL> REM	  SREYAS V	  CSE c 	  185001162
SQL> REM ********************************************************************
SQL> 
SQL> 
SQL> DROP TABLE Classes;

Table dropped.

SQL> 
SQL> CREATE TABLE Classes(
  2  class VARCHAR2(20) CONSTRAINT pk PRIMARY KEY,
  3  type VARCHAR2(2),
  4  country VARCHAR2(20),
  5  numguns NUMBER(3),
  6  bore NUMBER(3),
  7  displacement NUMBER(7)
  8  );

Table created.

SQL> 
SQL> INSERT INTO classes(class, type, country, numguns, bore, displacement) VALUES(
  2  	     'Bismark', 'bb', 'Germany', 8, 14, 32000
  3  	     );

1 row created.

SQL> 
SQL> 
SQL> INSERT INTO classes(class, type, country, numguns, bore, displacement) VALUES(
  2  	     'Iowa', 'bb', 'USA', 9, 16, 46000
  3  	     );

1 row created.

SQL> 
SQL> 
SQL> 
SQL> INSERT INTO classes VALUES(
  2  	     'Kongo', 'bc', 'Japan', 8, 15, 42000
  3  	     );

1 row created.

SQL> 
SQL> INSERT INTO classes VALUES(
  2  	     'North Carolina', 'bb', 'USA', 9, 16, 37000
  3  	     );

1 row created.

SQL> 
SQL> INSERT INTO classes VALUES(
  2  	     'Revenge', 'bb', 'Gt. Britain', 8, 15, 29000
  3  	     );

1 row created.

SQL> 
SQL> INSERT INTO classes VALUES(
  2  	     'Renown', 'bc', 'Gt. Britain', 6, 15, 32000
  3  	     );

1 row created.

SQL> 
SQL> SELECT * FROM Classes;

CLASS                TY COUNTRY                 NUMGUNS       BORE DISPLACEMENT                                                                                                                                                                                                                                                                                                                                                                                                                                                                                                                                                                                                                                                                                                                                                                                                                                                                                                                                                         
-------------------- -- -------------------- ---------- ---------- ------------                                                                                                                                                                                                                                                                                                                                                                                                                                                                                                                                                                                                                                                                                                                                                                                                                                                                                                                                                         
Bismark              bb Germany                       8         14        32000                                                                                                                                                                                                                                                                                                                                                                                                                                                                                                                                                                                                                                                                                                                                                                                                                                                                                                                                                         
Iowa                 bb USA                           9         16        46000                                                                                                                                                                                                                                                                                                                                                                                                                                                                                                                                                                                                                                                                                                                                                                                                                                                                                                                                                         
Kongo                bc Japan                         8         15        42000                                                                                                                                                                                                                                                                                                                                                                                                                                                                                                                                                                                                                                                                                                                                                                                                                                                                                                                                                         
North Carolina       bb USA                           9         16        37000                                                                                                                                                                                                                                                                                                                                                                                                                                                                                                                                                                                                                                                                                                                                                                                                                                                                                                                                                         
Revenge              bb Gt. Britain                   8         15        29000                                                                                                                                                                                                                                                                                                                                                                                                                                                                                                                                                                                                                                                                                                                                                                                                                                                                                                                                                         
Renown               bc Gt. Britain                   6         15        32000                                                                                                                                                                                                                                                                                                                                                                                                                                                                                                                                                                                                                                                                                                                                                                                                                                                                                                                                                         

6 rows selected.

SQL> 
SQL> SAVEPOINT B1;

Savepoint created.

SQL> 
SQL> UPDATE classes SET displacement=34000 WHERE class='Bismark';

1 row updated.

SQL> 
SQL> SELECT * FROM classes;

CLASS                TY COUNTRY                 NUMGUNS       BORE DISPLACEMENT                                                                                                                                                                                                                                                                                                                                                                                                                                                                                                                                                                                                                                                                                                                                                                                                                                                                                                                                                         
-------------------- -- -------------------- ---------- ---------- ------------                                                                                                                                                                                                                                                                                                                                                                                                                                                                                                                                                                                                                                                                                                                                                                                                                                                                                                                                                         
Bismark              bb Germany                       8         14        34000                                                                                                                                                                                                                                                                                                                                                                                                                                                                                                                                                                                                                                                                                                                                                                                                                                                                                                                                                         
Iowa                 bb USA                           9         16        46000                                                                                                                                                                                                                                                                                                                                                                                                                                                                                                                                                                                                                                                                                                                                                                                                                                                                                                                                                         
Kongo                bc Japan                         8         15        42000                                                                                                                                                                                                                                                                                                                                                                                                                                                                                                                                                                                                                                                                                                                                                                                                                                                                                                                                                         
North Carolina       bb USA                           9         16        37000                                                                                                                                                                                                                                                                                                                                                                                                                                                                                                                                                                                                                                                                                                                                                                                                                                                                                                                                                         
Revenge              bb Gt. Britain                   8         15        29000                                                                                                                                                                                                                                                                                                                                                                                                                                                                                                                                                                                                                                                                                                                                                                                                                                                                                                                                                         
Renown               bc Gt. Britain                   6         15        32000                                                                                                                                                                                                                                                                                                                                                                                                                                                                                                                                                                                                                                                                                                                                                                                                                                                                                                                                                         

6 rows selected.

SQL> 
SQL> UPDATE classes SET displacement=displacement*1.1 WHERE numguns>8 OR bore>14;

5 rows updated.

SQL> 
SQL> SELECT * FROM classes;

CLASS                TY COUNTRY                 NUMGUNS       BORE DISPLACEMENT                                                                                                                                                                                                                                                                                                                                                                                                                                                                                                                                                                                                                                                                                                                                                                                                                                                                                                                                                         
-------------------- -- -------------------- ---------- ---------- ------------                                                                                                                                                                                                                                                                                                                                                                                                                                                                                                                                                                                                                                                                                                                                                                                                                                                                                                                                                         
Bismark              bb Germany                       8         14        34000                                                                                                                                                                                                                                                                                                                                                                                                                                                                                                                                                                                                                                                                                                                                                                                                                                                                                                                                                         
Iowa                 bb USA                           9         16        50600                                                                                                                                                                                                                                                                                                                                                                                                                                                                                                                                                                                                                                                                                                                                                                                                                                                                                                                                                         
Kongo                bc Japan                         8         15        46200                                                                                                                                                                                                                                                                                                                                                                                                                                                                                                                                                                                                                                                                                                                                                                                                                                                                                                                                                         
North Carolina       bb USA                           9         16        40700                                                                                                                                                                                                                                                                                                                                                                                                                                                                                                                                                                                                                                                                                                                                                                                                                                                                                                                                                         
Revenge              bb Gt. Britain                   8         15        31900                                                                                                                                                                                                                                                                                                                                                                                                                                                                                                                                                                                                                                                                                                                                                                                                                                                                                                                                                         
Renown               bc Gt. Britain                   6         15        35200                                                                                                                                                                                                                                                                                                                                                                                                                                                                                                                                                                                                                                                                                                                                                                                                                                                                                                                                                         

6 rows selected.

SQL> 
SQL> 
SQL> DELETE FROM classes WHERE class='Kongo';

1 row deleted.

SQL> 
SQL> SELECT * FROM classes;

CLASS                TY COUNTRY                 NUMGUNS       BORE DISPLACEMENT                                                                                                                                                                                                                                                                                                                                                                                                                                                                                                                                                                                                                                                                                                                                                                                                                                                                                                                                                         
-------------------- -- -------------------- ---------- ---------- ------------                                                                                                                                                                                                                                                                                                                                                                                                                                                                                                                                                                                                                                                                                                                                                                                                                                                                                                                                                         
Bismark              bb Germany                       8         14        34000                                                                                                                                                                                                                                                                                                                                                                                                                                                                                                                                                                                                                                                                                                                                                                                                                                                                                                                                                         
Iowa                 bb USA                           9         16        50600                                                                                                                                                                                                                                                                                                                                                                                                                                                                                                                                                                                                                                                                                                                                                                                                                                                                                                                                                         
North Carolina       bb USA                           9         16        40700                                                                                                                                                                                                                                                                                                                                                                                                                                                                                                                                                                                                                                                                                                                                                                                                                                                                                                                                                         
Revenge              bb Gt. Britain                   8         15        31900                                                                                                                                                                                                                                                                                                                                                                                                                                                                                                                                                                                                                                                                                                                                                                                                                                                                                                                                                         
Renown               bc Gt. Britain                   6         15        35200                                                                                                                                                                                                                                                                                                                                                                                                                                                                                                                                                                                                                                                                                                                                                                                                                                                                                                                                                         

SQL> 
SQL> ROLLBACK TO B1;

Rollback complete.

SQL> 
SQL> SELECT * FROM classes;

CLASS                TY COUNTRY                 NUMGUNS       BORE DISPLACEMENT                                                                                                                                                                                                                                                                                                                                                                                                                                                                                                                                                                                                                                                                                                                                                                                                                                                                                                                                                         
-------------------- -- -------------------- ---------- ---------- ------------                                                                                                                                                                                                                                                                                                                                                                                                                                                                                                                                                                                                                                                                                                                                                                                                                                                                                                                                                         
Bismark              bb Germany                       8         14        32000                                                                                                                                                                                                                                                                                                                                                                                                                                                                                                                                                                                                                                                                                                                                                                                                                                                                                                                                                         
Iowa                 bb USA                           9         16        46000                                                                                                                                                                                                                                                                                                                                                                                                                                                                                                                                                                                                                                                                                                                                                                                                                                                                                                                                                         
Kongo                bc Japan                         8         15        42000                                                                                                                                                                                                                                                                                                                                                                                                                                                                                                                                                                                                                                                                                                                                                                                                                                                                                                                                                         
North Carolina       bb USA                           9         16        37000                                                                                                                                                                                                                                                                                                                                                                                                                                                                                                                                                                                                                                                                                                                                                                                                                                                                                                                                                         
Revenge              bb Gt. Britain                   8         15        29000                                                                                                                                                                                                                                                                                                                                                                                                                                                                                                                                                                                                                                                                                                                                                                                                                                                                                                                                                         
Renown               bc Gt. Britain                   6         15        32000                                                                                                                                                                                                                                                                                                                                                                                                                                                                                                                                                                                                                                                                                                                                                                                                                                                                                                                                                         

6 rows selected.

SQL> 
SQL> 
SQL> COMMIT;

Commit complete.

SQL> 
SQL> 
SQL> rem ********************************************************************************************
SQL> 
SQL> SPOOL OFF
